{
  "captureStatus": "supported",
  "capturedAt": "2026-08-10T01:17:30.731Z",
  "commands": [
    {
      "argv": [
        "$NODE",
        "node_modules/vitest/vitest.mjs",
        "run",
        "packages/standards/test/tuf-trust.unit.test.ts",
        "--reporter=json",
        "--outputFile=$TEMP/vitest.json"
      ],
      "deadlineMs": 60000,
      "durationMs": 3373,
      "exitCode": 0,
      "id": "tuf-trust",
      "signal": null,
      "tests": [
        {
          "identity": "H02 TUF trust model applies sequential root rotation under old and new thresholds and resets fast-forward state on online-key rotation",
          "outcome": "passed"
        },
        {
          "identity": "H02 TUF trust model bootstraps only the self-threshold-verified 2-of-3 out-of-band root",
          "outcome": "passed"
        },
        {
          "identity": "H02 TUF trust model bounds every request string before pattern work and preserves distinct resource failures",
          "outcome": "passed"
        },
        {
          "identity": "H02 TUF trust model bounds string ingress before UTF-8 allocation and rejects surrogate replacement aliases",
          "outcome": "passed"
        },
        {
          "identity": "H02 TUF trust model detects timestamp and snapshot rollback while preserving the trusted state",
          "outcome": "passed"
        },
        {
          "identity": "H02 TUF trust model exports the schema while excluding all test key material from the private package payload",
          "outcome": "passed"
        },
        {
          "identity": "H02 TUF trust model keeps stable and preview delegations isolated",
          "outcome": "passed"
        },
        {
          "identity": "H02 TUF trust model never reflects hostile map keys or accessor names in bounded diagnostics",
          "outcome": "passed"
        },
        {
          "identity": "H02 TUF trust model rejects an engine below the signed minimum while accepting exact and higher versions",
          "outcome": "passed"
        },
        {
          "identity": "H02 TUF trust model rejects delegated policy and target bindings outside their exact authority",
          "outcome": "passed"
        },
        {
          "identity": "H02 TUF trust model rejects expired, future-issued, and overlong online metadata using one explicit start time",
          "outcome": "passed"
        },
        {
          "identity": "H02 TUF trust model rejects hostile byte containers, JSON values, bundles, root chains, and requests",
          "outcome": "passed"
        },
        {
          "identity": "H02 TUF trust model rejects key-role reuse and wrong root policy identity",
          "outcome": "passed"
        },
        {
          "identity": "H02 TUF trust model rejects malformed root policy, authority, time, and signature structures",
          "outcome": "passed"
        },
        {
          "identity": "H02 TUF trust model rejects malformed, noncanonical, duplicate, BOM, deep, and oversized metadata before authority use",
          "outcome": "passed"
        },
        {
          "identity": "H02 TUF trust model rejects mix-and-match metadata and target length or hash changes",
          "outcome": "passed"
        },
        {
          "identity": "H02 TUF trust model rejects proxies, getters, sparse roots, exotic byte views, and extra byte authority",
          "outcome": "passed"
        },
        {
          "identity": "H02 TUF trust model rejects skipped roots and candidates missing either old or new root threshold",
          "outcome": "passed"
        },
        {
          "identity": "H02 TUF trust model rejects timestamp replay and snapshot rollback without changing prior trusted state",
          "outcome": "passed"
        },
        {
          "identity": "H02 TUF trust model requires 2-of-3 delegated signatures and enforces delegated key revocation",
          "outcome": "passed"
        },
        {
          "identity": "H02 TUF trust model retains an unchanged unselected delegation across a later channel update",
          "outcome": "passed"
        },
        {
          "identity": "H02 TUF trust model ships a closed Draft 2020-12 schema for every supported role",
          "outcome": "passed"
        },
        {
          "identity": "H02 TUF trust model validates every delegated target entry before selecting the requested binding",
          "outcome": "passed"
        },
        {
          "identity": "H02 TUF trust model verifies a complete stable update offline with exact parent bindings and returns defensive target bytes",
          "outcome": "passed"
        }
      ],
      "timedOut": false
    },
    {
      "argv": [
        "$NODE",
        "--test",
        "--test-reporter=tap",
        "tools/standards/maintainer-review-bundle.test.mjs",
        "tools/standards/upstream-review.test.mjs",
        "tools/standards/upstream-snapshotter.test.mjs",
        "tools/standards/validate-maintainer-workflow.test.mjs"
      ],
      "deadlineMs": 60000,
      "durationMs": 3444,
      "exitCode": 0,
      "id": "standards-tools",
      "signal": null,
      "tests": [
        {
          "identity": "accepts the checked-in least-privilege workflow and environment policy",
          "outcome": "passed"
        },
        {
          "identity": "aliased root",
          "outcome": "passed"
        },
        {
          "identity": "argument and byte boundaries fail before filesystem or artifact mutation",
          "outcome": "passed"
        },
        {
          "identity": "artifact parser fails closed on malformed, deep, huge, and incomplete JSON",
          "outcome": "passed"
        },
        {
          "identity": "artifact writer creates a private new directory and refuses overwrite or symlink parents",
          "outcome": "passed"
        },
        {
          "identity": "artifact writer is private, exclusive, canonical-path-only, and locally contained",
          "outcome": "passed"
        },
        {
          "identity": "bounded line evidence caps work and escapes hostile Unicode deterministically",
          "outcome": "passed"
        },
        {
          "identity": "cancellation stops the bounded sequential acquisition",
          "outcome": "passed"
        },
        {
          "identity": "candidate chronology fails closed without reflecting hostile artifact text",
          "outcome": "passed"
        },
        {
          "identity": "capture rejects invalid dates, signals, media, bytes, headings, and transport failures",
          "outcome": "passed"
        },
        {
          "identity": "capture requests only the exact sorted allowlist and replay is byte deterministic",
          "outcome": "passed"
        },
        {
          "identity": "catalog validation rejects URL broadening, omissions, reordering, and unknown fields",
          "outcome": "passed"
        },
        {
          "identity": "CLI accepts only the fixed create and verify argument order",
          "outcome": "passed"
        },
        {
          "identity": "content",
          "outcome": "passed"
        },
        {
          "identity": "context",
          "outcome": "passed"
        },
        {
          "identity": "creates a canonical closed manifest and replays exact bytes",
          "outcome": "passed"
        },
        {
          "identity": "extra",
          "outcome": "passed"
        },
        {
          "identity": "fails closed on content, manifest, context, and inventory substitution",
          "outcome": "passed"
        },
        {
          "identity": "generated source and provenance artifacts satisfy their published schemas",
          "outcome": "passed"
        },
        {
          "identity": "golden six-source change produces a deterministic claim-free draft",
          "outcome": "passed"
        },
        {
          "identity": "hard link",
          "outcome": "passed"
        },
        {
          "identity": "insertions and deletions retain explicit zero-sided bounded evidence",
          "outcome": "passed"
        },
        {
          "identity": "invalid run metadata",
          "outcome": "passed"
        },
        {
          "identity": "maintainer CLI capture requires acknowledgement and verify is network-free",
          "outcome": "passed"
        },
        {
          "identity": "maintainer CLI generates and replays offline without socket or command capability",
          "outcome": "passed"
        },
        {
          "identity": "manifest",
          "outcome": "passed"
        },
        {
          "identity": "noncanonical manifest",
          "outcome": "passed"
        },
        {
          "identity": "normalization is section-bounded, NFC, LF-only, and strips HTML-only content",
          "outcome": "passed"
        },
        {
          "identity": "offline replay rejects raw, normalized, provenance, digest, and noncanonical tampering",
          "outcome": "passed"
        },
        {
          "identity": "offline replay rejects review, scaffold, Markdown, and snapshot tampering",
          "outcome": "passed"
        },
        {
          "identity": "production transport independently rejects requests outside its compiled allowlist",
          "outcome": "passed"
        },
        {
          "identity": "public-address and response-header policies reject SSRF and protocol ambiguity",
          "outcome": "passed"
        },
        {
          "identity": "raw-only and identical changes remain distinct from selected text changes",
          "outcome": "passed"
        },
        {
          "identity": "rejects aliases, hard links, invalid metadata, and noncanonical JSON",
          "outcome": "passed"
        },
        {
          "identity": "rejects duplicate YAML keys and weakened checked-in environment policy",
          "outcome": "passed"
        },
        {